[
  {
    "id": 12345,
    "name": "iPhone 17 Pro",
    "manufacturer_name": "Apple",
    "release_date": "Released 2025, September 19"
  },
  {
    "id": 12348,
    "name": "iPhone 17 Pro Max",
    "manufacturer_name": "Apple",
    "release_date": "Released 2025, September 19"
  },
  {
    "id": 12200,
    "name": "iPhone 17",
    "manufacturer_name": "Apple",
    "release_date": "Released 2025, September 19"
  }
]
